chapterNo	chapterTitle	sectionNo	sectionTitle	sentence	sentence_cleaned
3	PART 1	1	India and the Ships navigating thither	Havine described so many inland provinces, I will now enter upon India, with the wonderful objects in that region.	havine described many inland provinces enter upon india wonderful objects region
3	PART 1	1	India and the Ships navigating thither	The ships in which the merchants navigate thither are made of fir, with only one deck, but many of them are divided beneath into sixty compartments, in each of which a person can be conveniently accommodated.	ships merchants navigate thither made fir one deck many divided beneath sixty compartments person conveniently accommodated
3	PART 1	1	India and the Ships navigating thither	They have one rudder and four masts ; while some have two additional, which can be put up and taken down at pleasure.	one rudder four masts two additional put taken pleasure
3	PART 1	1	India and the Ships navigating thither	Many of the largest have besides as many as thirteen divisions in the hold, formed of thick planks mortised into each other.	many largest besides many thirteen divisions hold formed thick planks mortised
3	PART 1	1	India and the Ships navigating thither	The object is to guard against accidents which may cause the vessel to spring a leak, such as striking on a rock or being attacked by a whale, This last circumstance is not unusual ; for dur-  ing the night the motion of the ship through the waves  raises a foam that invites the hungry animal, which,  hoping to find food, rushes violently against the hull,  and often forces in part of the bottom.	object guard accidents may cause vessel spring leak striking rock attacked whale last circumstance unusual dur ing night motion ship waves raises foam invites hungry animal hoping find food rushes violently hull often forces part bottom
3	PART 1	1	India and the Ships navigating thither	The water,  entering by the leak, runs on to the well, which is al-  ways kept clear ; and the crew, on perceiving the occur-  rence, remove the goods from the inundated division, and  the boards are so tight that it cannot pass to any other.	water entering leak runs well al ways kept clear crew perceiving occur rence remove goods inundated division boards tight pass
3	PART 1	1	India and the Ships navigating thither	They then repair the injury and replace the articles.	repair injury replace articles
3	PART 1	1	India and the Ships navigating thither	The  plaiJ^ are double, fastened with iron nails, and plastered  without and within, but not secured by pitch, of which  the people are destitute.	plaij double fastened iron nails plastered without within secured pitch people destitute
3	PART 1	1	India and the Ships navigating thither	They therefore take lime, beat  it into fine powder, and mix it with an oil from trees, so  that it becomes equal to glue.	therefore take lime beat fine powder mix oil trees becomes equal glue
3	PART 1	1	India and the Ships navigating thither	These vessels carry two  hundred mariners, and five or six thousand loads of  pepper ; they are moved by oars, on each of which four  hands are employed.	vessels carry two hundred mariners five six thousand loads pepper moved oars four hands employed
3	PART 1	1	India and the Ships navigating thither	Every one of them has two barks,  large enough to carry a thousand loads, and forty seamen  well armed, who often assist in dragging the large ships.	every one two barks large enough carry thousand loads forty seamen well armed often assist dragging large ships
3	PART 1	1	India and the Ships navigating thither	Ten small boats are also kept for fishing and various other services ; two being attached to each bark.	ten small boats also kept fishing various services two attached bark
3	PART 1	1	India and the Ships navigating thither	‘When the ships have sailed a year, and stand in need of repair, a fresh plank is fastened above the two others, then nailed and cemented, till they sometimes acquire a depth of six planks.	‘when ships sailed year stand need repair fresh plank fastened two others nailed cemented till sometimes acquire depth six planks
3	PART 1	1	India and the Ships navigating thither	Having thus described the merchant-vessels that go to India, I will tell you of the country itself ; but first I must mention the many isles in this sea lying to the eastward ; and first, of one named Zipangu.	thus described merchantvessels go india tell country first must mention many isles sea lying eastward first one named zipangu
3	PART 1	10	Kingdom of Ferlech	In that of Ferlech are Saracen merchants, who come with their vessels, and have converted the people to the law of Mohammed ; but only in the city, for those in the mountains live like brutes, eating the flesh of men and of the vilest animals.	ferlech saracen merchants come vessels converted people law mohammed city mountains live like brutes eating flesh men vilest animals
3	PART 1	10	Kingdom of Ferlech	They worship various objects, particularly the first thing they meet after rising in the morning.	worship various objects particularly first thing meet rising morning
3	PART 1	11	Kingdom of Basman	Leaving Ferlech, you enter Basman,a kingdom by itself, whose people have a language of their own, and live without law, like beasts.	leaving ferlech enter basmana kingdom whose people language live without law like beasts
3	PART 1	11	Kingdom of Basman	They own the supremacy of the khan, but pay him no tribute, because the great distance prevents his troops from reaching them; yet they sometimes make him a present of strange objects.	supremacy khan pay tribute great distance prevents troops reaching yet sometimes make present strange objects
3	PART 1	11	Kingdom of Basman	Here are wild elephants, and unicorns not much smaller, being double the size of a buffalo.	wild elephants unicorns much smaller double size buffalo
3	PART 1	11	Kingdom of Basman	They have a large black horn in the middle of the forehead, and beneath the tongue sharp prickles, which can inflict severe wounds, Their heads resemble that of the wild boar, yet they carry them bent to the earth.	large black horn middle forehead beneath tongue sharp prickles inflict severe wounds heads resemble wild boar yet carry bent earth
3	PART 1	11	Kingdom of Basman	They are very ugly, and fond of wallowing among mire.	ugly fond wallowing among mire
3	PART 1	11	Kingdom of Basman	It is not true, as asserted among us, that they allow themselves to be taken by a virgin, but quite the contrary.	true asserted among us allow taken virgin quite contrary
3	PART 1	11	Kingdom of Basman	There are here good and serviceable falcons, black like crows ; also a prodigious number of monkeys of various forms and habits.	good serviceable falcons black like crows also prodigious number monkeys various forms habits
3	PART 1	11	Kingdom of Basman	But you must know that those who bring the little men from India practise a great deception.	must know bring little men india practise great deception
3	PART 1	11	Kingdom of Basman	I assure you the figures to which they give that name are manufactured in this island in the following manner :— There is a species of small monkey, with a face resembling the human, which they catch, skin, and shave off all the hair except on the beard and chin; having then moulded them intoa human semblance, they dryand preservethem with camphor and other articles.	assure figures give name manufactured island following manner — species small monkey face resembling human catch skin shave hair except beard chin moulded intoa human semblance dryand preservethem camphor articles
3	PART 1	11	Kingdom of Basman	But it is a gross deception ; for neither in India, nor in any other country, however savage, are there men so small as these pretended ones.	gross deception neither india country however savage men small pretended ones
3	PART 1	11	Kingdom of Basman	t Now let us tell of a kingdom called Samara.	let us tell kingdom called samara
3	PART 1	12	Kingdom of Samara	When a man departs from Basman, he finds the kingdom of Samara, in which I myself, Marco Polo, remained five months, because the bad weather did not allow us to sail, Here neither the north star nor the constellation of the Greater Bear appeared.	man departs basman finds kingdom samara marco polo remained five months bad weather allow us sail neither north star constellation greater bear appeared
3	PART 1	12	Kingdom of Samara	The people are savage idolaters, governed by a rich and powerful king, and owning a nominal submission to the great khan.	people savage idolaters governed rich powerful king owning nominal submission great khan
3	PART 1	12	Kingdom of Samara	During our stay, we landed and erected castles of wood and twigs, where we remained through the fear of these wicked men, who eat their fellow-creatures.	stay landed erected castles wood twigs remained fear wicked men eat fellowcreatures
3	PART 1	12	Kingdom of Samara	The best fishes in the world are found here.	best fishes world found
3	PART 1	12	Kingdom of Samara	The people have no wheat, living on rice ; and they make no wine.	people wheat living rice make wine
3	PART 1	12	Kingdom of Samara	You must know there is a kind of tree, of which they cut a branch, and place a pot beneath, when, during the night, the vessel is filled, and very good wine is thus produced, both red and white.	must know kind tree cut branch place pot beneath night vessel filled good wine thus produced red white
3	PART 1	12	Kingdom of Samara	The tree resembles a small date-palm, with four branches, and when it ceases to give out more wine, they water its root, which causes it to produce again.	tree resembles small datepalm four branches ceases give wine water root causes produce
3	PART 1	12	Kingdom of Samara	* They have great quantities of very large Indian nuts, and eat all kinds of flesh, good and bad.	great quantities large indian nuts eat kinds flesh good bad
3	PART 1	12	Kingdom of Samara	Now let us tell you of a kingdom which is named Dagroian.	let us tell kingdom named dagroian
3	PART 1	13	Kingdom of Dagroian	This kingdom has a language of its own; the people are very savage, subject to a king, but owning the supremacy of the great khan.	kingdom language people savage subject king owning supremacy great khan
3	PART 1	13	Kingdom of Dagroian	They are savage idolaters, and have the following very bad custom :—When a man falls sick, his relations send for the magicians, and inquire if he will recover, as these deceivers profess to know, by their enchantments and idols, whether he will live or die.	savage idolaters following bad custom —when man falls sick relations send magicians inquire recover deceivers profess know enchantments idols whether live die
3	PART 1	13	Kingdom of Dagroian	Inthe latter case, the friends send for persons who place something over hismouth, by which he is suffocated.	inthe latter case friends send persons place something hismouth suffocated
3	PART 1	13	Kingdom of Dagroian	They then cook the body, and all the kinsmen come and eat his flesh, taking care not to leave the smallest portion; which they believe would breed worms, and thus seriously afflict the soul of the deceased.	cook body kinsmen come eat flesh taking care leave smallest portion believe would breed worms thus seriously afflict soul deceased
3	PART 1	13	Kingdom of Dagroian	They next collect the bones, and place them in a large and beautiful chest, which they carry to caverns in the mountains, beyond the reach of wild beasts or any other injury.	next collect bones place large beautiful chest carry caverns mountains beyond reach wild beasts injury
3	PART 1	13	Kingdom of Dagroian	When they take any man belonging to another country, who cannot redeem himself, they kill and eat him in like manner.	take man belonging another country redeem kill eat like manner
3	PART 1	13	Kingdom of Dagroian	This is a very bad practice.	bad practice
3	PART 1	13	Kingdom of Dagroian	I must now, however, tell you something of Lambri.	must however tell something lambri
3	PART 1	14	Kingdom of Lambri	Lambri is a kingdom having a sovereign of its own, who owns the supremacy of the khan.	lambri kingdom sovereign owns supremacy khan
3	PART 1	14	Kingdom of Lambri	The people are all idolaters ; they have a great abundance of camphor and other spices ; likewise brazil-wood.	people idolaters great abundance camphor spices likewise brazilwood
3	PART 1	14	Kingdom of Lambri	This they sow, and when it has grown to a little twig, they transplant it to another place, and at the end of three years root it up.	sow grown little twig transplant another place end three years root
3	PART 1	14	Kingdom of Lambri	We brought some of this seed to Venice, but it did not spring at all on account of the cold.	brought seed venice spring account cold
3	PART 1	14	Kingdom of Lambri	I will tell you another very wonderful thing ; for there are men in this kingdom who have tails like dogs, larger than a palm, and who are covered with hair.	tell another wonderful thing men kingdom tails like dogs larger palm covered hair
3	PART 1	14	Kingdom of Lambri	They remain in the mountains, never visiting the towns.	remain mountains never visiting towns
3	PART 1	14	Kingdom of Lambri	* There are unicorns, with various beasts and birds for hunting.	unicorns various beasts birds hunting
3	PART 1	14	Kingdom of Lambri	Now let us depart and tell you of Fansur.	let us depart tell fansur
3	PART 1	15	Kingdom of Fansur	The people of Fansur are idolaters, have a king, and nominally acknowledge the great khan.	people fansur idolaters king nominally acknowledge great khan
3	PART 1	15	Kingdom of Fansur	Here grows the best canfara fansuri, which is much more valued than any other ; indeed it sells for its weight in gold.	grows best canfara fansuri much valued indeed sells weight gold
3	PART 1	15	Kingdom of Fansur	Wine is drawn from trees, in the manner described above : another wonder is, that, in this province, meal is obtained from them.	wine drawn trees manner described another wonder province meal obtained
3	PART 1	15	Kingdom of Fansur	These are large, the bark thin, and the interior all full of meal.	large bark thin interior full meal
3	PART 1	15	Kingdom of Fansur	The inhabitants take it out, and make a very good paste, of which we often ate.	inhabitants take make good paste often ate
3	PART 1	15	Kingdom of Fansur	Having told you of the kingdoms in this part of the isle, I will say nothing of the two others, because we did not.	told kingdoms part isle say nothing two others
3	PART 1	15	Kingdom of Fansur	visit them.	visit
3	PART 1	15	Kingdom of Fansur	I will now, therefore, go to another small island called Gavenispola.	therefore go another small island called gavenispola
3	PART 1	16	Islands of Necuveran and Angaman (Nicobar and Andaman)	Departing from Java and the kingdom of Lambri, and travelling northward about 150 miles, you find two islands, one of which is called Necuveran.	departing java kingdom lambri travelling northward 150 miles find two islands one called necuveran
3	PART 1	16	Islands of Necuveran and Angaman (Nicobar and Andaman)	t The people have no king, and live like brutes, both men and women going quite naked.	people king live like brutes men women going quite naked
3	PART 1	16	Islands of Necuveran and Angaman (Nicobar and Andaman)	They are idolaters, and have forests of noble and valuable trees ; among which are sandal-wood, the Indian nut, clove, brazil, and many others.	idolaters forests noble valuable trees among sandalwood indian nut clove brazil many others
3	PART 1	16	Islands of Necuveran and Angaman (Nicobar and Andaman)	Angaman is a very large island, without a king; the people idolaters, resembling savage beasts; indeed they are a most extraordinary race, having a head, teeth, and jaws like those of a mastiff dog.	angaman large island without king people idolaters resembling savage beasts indeed extraordinary race head teeth jaws like mastiff dog
3	PART 1	16	Islands of Necuveran and Angaman (Nicobar and Andaman)	They are very cruel, and eat all the men of every other nation whom they can seize.	cruel eat men every nation seize
3	PART 1	16	Islands of Necuveran and Angaman (Nicobar and Andaman)	They have great abundance and variety of spices, with fruits different from ours, but live chiefly on flesh and milk.	great abundance variety spices fruits different live chiefly flesh milk
3	PART 1	16	Islands of Necuveran and Angaman (Nicobar and Andaman)	Having told of these various people, I will now mention another island.	told various people mention another island
3	PART 1	17	Island of Seilan	When you depart from Angaman, and sail.	depart angaman sail
3	PART 1	17	Island of Seilan	about a thousand miles westward, a little to the south, you reach the island of Seilan,the very best of its size in the world.	thousand miles westward little south reach island seilanthe best size world
3	PART 1	17	Island of Seilan	It is 2400 miles in circuit ; yet I must tell you that anciently it was larger, being 3600, as appears by the old maps of the mariners on that sea ; but the north wind blows with such violence, that a great part has been carried away by the water.	2400 miles circuit yet must tell anciently larger 3600 appears old maps mariners sea north wind blows violence great part carried away water
3	PART 1	17	Island of Seilan	[ The people have a king called Sendemain, and are tributary to none ; they are idolaters, and go quite naked, except a small covering round the middle.	people king called sendemain tributary none idolaters go quite naked except small covering round middle
3	PART 1	17	Island of Seilan	They have no grain but rice, living on it and on flesh.	grain rice living flesh
3	PART 1	17	Island of Seilan	I will now describe the most precious thing in the world; for here are noble and beautiful rubies, which can be procured nowhere else ; also the sapphire, the topaz, the amethyst, and various other precious stones.	describe precious thing world noble beautiful rubies procured nowhere else also sapphire topaz amethyst various precious stones
3	PART 1	17	Island of Seilan	The king has the most beautiful ruby that ever was or can be in the whole world.	king beautiful ruby ever whole world
3	PART 1	17	Island of Seilan	It is the most splendid object on earth, and seems to glow like fire; it is of such value as money could scarcely purchase.	splendid object earth seems glow like fire value money could scarcely purchase
3	PART 1	17	Island of Seilan	The great khan sent his messengers to him, wishing to buy it, and offering the value of a city.	great khan sent messengers wishing buy offering value city
3	PART 1	17	Island of Seilan	The monarch replied, that he had received it from his ancestors, and would for no earthly consideration part with it.	monarch replied received ancestors would earthly consideration part
3	PART 1	17	Island of Seilan	The people are not menat-arms, but unwarlike and cowardly ; when they need soldiers in war, they send for those of another country, commonly for Saracens.	people menatarms unwarlike cowardly need soldiers war send another country commonly saracens
3	PART 1	18	Origin of the Boodhist Religion in Seilan	I have also to tell you that in this island there is a great mountain, of which the rocks are so broken that it can be ascended only by chains of iron suspended, whereby men may mount to the summit.	also tell island great mountain rocks broken ascended chains iron suspended whereby men may mount summit
3	PART 1	18	Origin of the Boodhist Religion in Seilan	Here, according to the Saracens, is the monument of Adam our first father ; but the idolaters consider it as that of Sergamon Borcam.	according saracens monument adam first father idolaters consider sergamon borcam
3	PART 1	18	Origin of the Boodhist Religion in Seilan	They describe this last as the first man whose image they worshipped, and as the best that ever lived in their country.	describe last first man whose image worshipped best ever lived country
3	PART 1	18	Origin of the Boodhist Religion in Seilan	He was son to a great, rich, and powerful king, yet refused to succeed to the throne, or to attend to any worldly concern.	son great rich powerful king yet refused succeed throne attend worldly concern
3	PART 1	18	Origin of the Boodhist Religion in Seilan	The monarch, who had no other son, was both grieved and angry.	monarch son grieved angry
3	PART 1	18	Origin of the Boodhist Religion in Seilan	He made him large promises, offering even to resign, and raise him immediately te the throne ; but the youth would listen to no such proposal.	made large promises offering even resign raise immediately te throne youth would listen proposal
3	PART 1	18	Origin of the Boodhist Religion in Seilan	The father was like to die of grief, but bethought himself of a plan for bringing him back to the world.	father like die grief bethought plan bringing back world
3	PART 1	18	Origin of the Boodhist Religion in Seilan	He lodged him in a very fine palace, and appointed 30,000 beautiful damsels to serve and amuse him.	lodged fine palace appointed 30000 beautiful damsels serve amuse
3	PART 1	18	Origin of the Boodhist Religion in Seilan	The prince, however, remained insensible to their seductions, and led a more virtuous and chaste life than before.	prince however remained insensible seductions led virtuous chaste life
3	PART 1	18	Origin of the Boodhist Religion in Seilan	Now his habits had been g0 recluse that he had never seen a dead person, or one not perfectly sound in his members.	habits g0 recluse never seen dead person one perfectly sound members
3	PART 1	18	Origin of the Boodhist Religion in Seilan	One day, happening to ride across the path where a man lay dead, he was utterly astonished, and asked of his attendants what that was.	one day happening ride across path man lay dead utterly astonished asked attendants
3	PART 1	18	Origin of the Boodhist Religion in Seilan	This being explained, he inquired if all men died, and being told they did so, he walked on, musing very deeply.	explained inquired men died told walked musing deeply
3	PART 1	18	Origin of the Boodhist Religion in Seilan	Some time after, he saw one unable to walk, and with all his teeth decayed through extreme old age.	time saw one unable walk teeth decayed extreme old age
3	PART 1	18	Origin of the Boodhist Religion in Seilan	Having asked, and being informed what that was, he declared he would no longer remain in this evil region, but would seek a place where men neither died nor grew old.	asked informed declared would longer remain evil region would seek place men neither died grew old
3	PART 1	18	Origin of the Boodhist Religion in Seilan	He left the palace, and journeyed into great and trackless mountains, where he spent his whole life virtuously and chastely, observing rigid abstinence ; so that had he been a Christian, he must have been a very great saint.	left palace journeyed great trackless mountains spent whole life virtuously chastely observing rigid abstinence christian must great saint
3	PART 1	18	Origin of the Boodhist Religion in Seilan	When he died, his corpse was carried to his father, who, on seeing the body of one whom he loved better than himself, was grieved to the heart.	died corpse carried father seeing body one loved better grieved heart
3	PART 1	18	Origin of the Boodhist Religion in Seilan	He made an image of him composed of gold and precious stones.	made image composed gold precious stones
3	PART 1	18	Origin of the Boodhist Religion in Seilan	All the people of the country adored him as a god, and they say that he died eighty-four times, becoming first an ox, then a horse, then a dog, and various other animals ; but that the eighty-fourth time he became a god, and they worship him as their best and greatest.	people country adored god say died eightyfour times becoming first ox horse dog various animals eightyfourth time became god worship best greatest
3	PART 1	18	Origin of the Boodhist Religion in Seilan	These were the first idolaters, from whom all the others in Seilan were descended.	first idolaters others seilan descended
3	PART 1	18	Origin of the Boodhist Religion in Seilan	But I assure you, many from the most distant countries come hither on pilgrimage, as Christians to the shrine of St James, and the monument on this mountain is said to be that of the prince, whose teeth, hair, and skull were preserved.	assure many distant countries come hither pilgrimage christians shrine st james monument mountain said prince whose teeth hair skull preserved
3	PART 1	18	Origin of the Boodhist Religion in Seilan	But the Saracens say that it is that of Adam, our first parent.	saracens say adam first parent
3	PART 1	18	Origin of the Boodhist Religion in Seilan	God knows which is right, but one cannot believe the latter, for the Scriptures of our holy church assure us that he died in another part of the world.	god knows right one believe latter scriptures holy church assure us died another part world
3	PART 1	18	Origin of the Boodhist Religion in Seilan	Now it happened that the great khan, hearing that the tomb of Adam, with the other objects mentioned, was on this mountain, sent, in 1284, a numerous embassy, who travelled by land to the island of Seilan.	happened great khan hearing tomb adam objects mentioned mountain sent 1284 numerous embassy travelled land island seilan
3	PART 1	18	Origin of the Boodhist Religion in Seilan	They went to the king, and procured two of the grinding teeth, which were very large, also the hair, and the cup, of beautiful green porphyry.	went king procured two grinding teeth large also hair cup beautiful green porphyry
